{
    "schemaVersion":  "1.0",
    "packageId":  "6a21ca47-a7c1-4eac-b8cf-a4a5d8d63784",
    "generatorVersion":  "gala-0.1.0",
    "reviewPlanId":  "8e812950-3311-40a7-93ab-636409df8cc2",
    "snapshotVersion":  "plan-graph-1.0:3da5f48f37ac57c91b49ee747c11e45f1a9e9e73d8e892fcd1bd1f9f3f50c620",
    "entrySceneId":  "scene-001",
    "scenes":  [
                   {
                       "sceneId":  "scene-001",
                       "title":  "图书馆的自习时光",
                       "dialogue":  [
                                        {
                                            "speakerId":  "林学姐",
                                            "text":  "嘿，学弟！今天学姐陪你一起复习农业知识吧。",
                                            "emotion":  "cheerful"
                                        },
                                        {
                                            "speakerId":  "林学姐",
                                            "text":  "今天我们要复习的主题是：水稻·生长周期",
                                            "emotion":  "encouraging"
                                        }
                                    ],
                       "choices":  [
                                       {
                                           "choiceId":  "c-scene-001-1",
                                           "questionId":  "c3bd304f-dc44-4f55-8608-64c20672e90a",
                                           "text":  "准备好了，开始吧！",
                                           "nextSceneId":  "scene-002",
                                           "scoreDelta":  0,
                                           "knowledgePointId":  "d1adc45a-52db-4de2-9cf7-02e1ac0d53cb"
                                       }
                                   ],
                       "knowledgeBindings":  [
                                                 {
                                                     "knowledgePointId":  "d1adc45a-52db-4de2-9cf7-02e1ac0d53cb",
                                                     "questionId":  "c3bd304f-dc44-df55-8608-64c20672e90a",
                                                     "purpose":  "FEEDBACK"
                                                 }
                                             ]
                   },
                   {
                       "sceneId":  "scene-002",
                       "title":  "知识点讲解：水稻基本生长周期",
                       "dialogue":  [
                                        {
                                            "speakerId":  "林学姐",
                                            "text":  "在正式提问之前，先回顾一下「水稻基本生长周期」。",
                                            "emotion":  "thoughtful"
                                        },
                                        {
                                            "speakerId":  "林学姐",
                                            "text":  "水稻从播种到成熟的完整生长周期，包括幼苗期、分蘖期、拔节期、抽穗期和成熟期。",
                                            "emotion":  "explaining"
                                        }
                                    ],
                       "choices":  [
                                       {
                                           "choiceId":  "c-scene-002-1",
                                           "questionId":  "b8a4c1be-db80-4759-9ecf-8f4ad0cfcfd5",
                                           "text":  "了解了，继续。",
                                           "nextSceneId":  "scene-003",
                                           "scoreDelta":  0,
                                           "knowledgePointId":  "84f7d873-e573-4689-b18d-6f82c745d1bf"
                                       }
                                   ],
                       "knowledgeBindings":  [
                                                 {
                                                     "knowledgePointId":  "84f7d873-e573-4689-b18d-6f82c745d1bf",
                                                     "questionId":  "b8a4c1be-db80-1759-9ecf-8f4ad0cfcfd5",
                                                     "purpose":  "EXPLAIN"
                                                 }
                                             ]
                   },
                   {
                       "sceneId":  "scene-003",
                       "title":  "复习题：水稻分蘖期管理",
                       "dialogue":  [
                                        {
                                            "speakerId":  "林学姐",
                                            "text":  "来，看看这道题你掌握得怎么样？",
                                            "emotion":  "challenging"
                                        },
                                        {
                                            "speakerId":  "林学姐",
                                            "text":  "水稻分蘖期管理——根据所学内容，关于「水稻分蘖期管理」最准确的描述是？",
                                            "emotion":  "questioning"
                                        }
                                    ],
                       "choices":  [
                                       {
                                           "choiceId":  "c-scene-003-d1",
                                           "questionId":  "0aeb0c5d-4e43-485e-9af0-79e0ddc902a0",
                                           "text":  "水稻基本生长周期",
                                           "nextSceneId":  "scene-004",
                                           "scoreDelta":  0,
                                           "answerKind":  "CHOICE",
                                           "correct":  false,
                                           "knowledgePointId":  "d1adc45a-52db-4de2-9cf7-02e1ac0d53cb"
                                       },
                                       {
                                           "choiceId":  "c-scene-003-d2",
                                           "questionId":  "0aeb0c5d-4e43-485e-9af0-79e0ddc902a0",
                                           "text":  "部分正确但不完整",
                                           "nextSceneId":  "scene-004",
                                           "scoreDelta":  0,
                                           "answerKind":  "CHOICE",
                                           "correct":  false,
                                           "knowledgePointId":  "d1adc45a-52db-4de2-9cf7-02e1ac0d53cb"
                                       },
                                       {
                                           "choiceId":  "c-scene-003-correct",
                                           "questionId":  "0aeb0c5d-4e43-485e-9af0-79e0ddc902a0",
                                           "text":  "水稻分蘖期最关键的管理目标是协调群体数量与个体生长，通过水肥调控促进有效分蘖",
                                           "nextSceneId":  "scene-004",
                                           "scoreDelta":  1,
                                           "answerKind":  "CHOICE",
                                           "correct":  true,
                                           "knowledgePointId":  "d1adc45a-52db-4de2-9cf7-02e1ac0d53cb"
                                       },
                                       {
                                           "choiceId":  "c-scene-003-d3",
                                           "questionId":  "0aeb0c5d-4e43-485e-9af0-79e0ddc902a0",
                                           "text":  "方向相反的结论",
                                           "nextSceneId":  "scene-004",
                                           "scoreDelta":  0,
                                           "answerKind":  "CHOICE",
                                           "correct":  false,
                                           "knowledgePointId":  "d1adc45a-52db-4de2-9cf7-02e1ac0d53cb"
                                       }
                                   ],
                       "knowledgeBindings":  [
                                                 {
                                                     "knowledgePointId":  "d1adc45a-52db-4de2-9cf7-02e1ac0d53cb",
                                                     "questionId":  "0aeb0c5d-4e43-485e-9af0-79e0ddc902a0",
                                                     "purpose":  "QUESTION"
                                                 }
                                             ]
                   },
                   {
                       "sceneId":  "scene-004",
                       "title":  "复习结束",
                       "dialogue":  [
                                        {
                                            "speakerId":  "林学姐",
                                            "text":  "做得不错！看来这些知识点你已经掌握了。",
                                            "emotion":  "proud"
                                        },
                                        {
                                            "speakerId":  "林学姐",
                                            "text":  "本次复习共完成 1 道题目，辛苦了！",
                                            "emotion":  "warm"
                                        }
                                    ],
                       "choices":  [

                                   ],
                       "knowledgeBindings":  [

                                             ]
                   }
               ],
    "assets":  [

               ]
}
